{
  "$schema": "https://json-schema.org/draft/2020-12/schema",
  "type": "object",
  "required": ["concept_tag", "assembly_root_sha256", "r9_manifest_sha256", "r9_inputs", "outputs", "notes"],
  "properties": {
    "concept_tag": {
      "type": "string"
    },
    "assembly_root_sha256": {
      "type": "string",
      "pattern": "^[0-9a-f]{64}$"
    },
    "r9_manifest_sha256": {
      "type": "string",
      "pattern": "^[0-9a-f]{64}$"
    },
    "r9_inputs": {
      "type": "array",
      "items": {
        "type": "object",
        "required": ["path", "sha256"],
        "properties": {
          "path": { "type": "string" },
          "sha256": { "type": "string", "pattern": "^[0-9a-f]{64}$" }
        }
      }
    },
    "outputs": {
      "type": "array",
      "items": {
        "type": "object",
        "required": ["path", "sha256"],
        "properties": {
          "path": { "type": "string" },
          "sha256": { "type": "string", "pattern": "^[0-9a-f]{64}$" }
        }
      }
    },
    "notes": {
      "type": "string"
    }
  }
}
